{
  "$schema": "https://json-schema.org/draft/2020-12/schema",
  "$id": "https://example.com/wtq/quartets.schema.json",
  "title": "Well-Tempered Quartet — piece list",
  "description": "Array of string quartet candidates, one per piece, grouped conceptually by key. Generated from some_quartets_by_key.xlsx via xlsx_to_json.py.",
  "type": "array",
  "items": {
    "type": "object",
    "required": ["sharps", "key", "mode", "composer", "status"],
    "additionalProperties": false,
    "properties": {
      "sharps": {
        "type": "number",
        "description": "Number of sharps in the key signature (negative = flats). Range −7 … +7.",
        "minimum": -7,
        "maximum": 7
      },
      "key": {
        "type": "string",
        "description": "Tonal centre as spelled in the source spreadsheet, e.g. 'C', 'F-sharp', 'B-flat', 'D-flat'. May use enharmonic spellings; canonical WTC names are resolved in the dashboard.",
        "examples": ["C", "D-flat", "Eb", "F-sharp", "A-flat", "B-flat"]
      },
      "mode": {
        "type": "string",
        "enum": ["Major", "Minor", "n/a"],
        "description": "Modal quality of the key."
      },
      "composer": {
        "type": "string",
        "description": "Composer's surname (and initial where needed for disambiguation).",
        "minLength": 1,
        "examples": ["Haydn", "Beethoven", "Shostakovich", "Boccherini"]
      },
      "piece": {
        "type": "string",
        "description": "Opus number, catalogue number, or short title. Empty string when not yet determined ('tbd' is normalised away).",
        "examples": ["20/5", "Op. 131", "K. 387", "Art of Fugue", ""]
      },
      "notes": {
        "type": "string",
        "description": "Free-text commentary on tonality, fugal content, caveats, etc.",
        "examples": ["last mvt fugue", "in F but has D♭ major 2nd mvt", ""]
      },
      "scoreUrl": {
        "description": "URL to a score (typically IMSLP). Empty string when not available.",
        "oneOf": [
          { "const": "" },
          { "type": "string", "format": "uri", "minLength": 1 }
        ],
        "examples": [
          "https://imslp.org/wiki/String_Quartet_No.1_%27Kreutzer_Sonata%27_(Jan%C3%A1%C4%8Dek,_Leo%C5%A1)",
          ""
        ]
      },
      "ytUrl": {
        "description": "URL to a YouTube recording or score-video. Empty string when not available.",
        "oneOf": [
          { "const": "" },
          { "type": "string", "format": "uri", "minLength": 1 }
        ],
        "examples": [
          "https://www.youtube.com/watch?v=9CpSDFYnUOY",
          ""
        ]
      },
      "status": {
        "type": "string",
        "enum": ["candidate", "uncertain", "alternate", "rejected"],
        "description": "Editorial status, derived from cell background colour in the source spreadsheet. 'candidate' = primary selection; 'uncertain' = tonality or content questionable; 'alternate' = backup option; 'rejected' = struck from consideration."
      }
    }
  }
}
