[
  {
    "sharps": -7.0,
    "key": "A-flat",
    "mode": "Minor",
    "composer": "Janacek",
    "piece": "#1, Kreutzer Sonata",
    "notes": "arguably not in a key, but 2nd and 4th mvts seem to be centered around Ab, with minor tonality",
    "scoreUrl": "https://imslp.org/wiki/String_Quartet_No.1_%27Kreutzer_Sonata%27_(Jan%C3%A1%C4%8Dek,_Leo%C5%A1)",
    "ytUrl": "",
    "status": "uncertain"
  },
  {
    "sharps": -6.0,
    "key": "E-flat",
    "mode": "Minor",
    "composer": "Tchaikovsky",
    "piece": "#3",
    "notes": "",
    "scoreUrl": "",
    "ytUrl": "",
    "status": "candidate"
  },
  {
    "sharps": -6.0,
    "key": "E-flat",
    "mode": "Minor",
    "composer": "Shostakovich",
    "piece": "#15",
    "notes": "",
    "scoreUrl": "",
    "ytUrl": "",
    "status": "candidate"
  },
  {
    "sharps": -5.0,
    "key": "D-flat",
    "mode": "Major",
    "composer": "Shostakovich",
    "piece": "#12",
    "notes": "",
    "scoreUrl": "",
    "ytUrl": "",
    "status": "candidate"
  },
  {
    "sharps": -5.0,
    "key": "D-flat",
    "mode": "Major",
    "composer": "Dohnanyi",
    "piece": "#2",
    "notes": "",
    "scoreUrl": "",
    "ytUrl": "",
    "status": "candidate"
  },
  {
    "sharps": -5.0,
    "key": "D-flat",
    "mode": "Major",
    "composer": "Toch",
    "piece": "#8",
    "notes": "a lot of imitative writing, fugal section in mvt ii",
    "scoreUrl": "https://imslp.org/wiki/String_Quartet_No.8,_Op.18_(Toch,_Ernst)",
    "ytUrl": "https://www.youtube.com/watch?v=vjpnVDOoB4c",
    "status": "alternate"
  },
  {
    "sharps": -5.0,
    "key": "D-flat",
    "mode": "Major",
    "composer": "Tchaikovsky",
    "piece": "#2",
    "notes": "in F but has Db major 2nd mvt",
    "scoreUrl": "https://imslp.org/wiki/String_Quartet_No.2,_Op.22_(Tchaikovsky,_Pyotr)",
    "ytUrl": "",
    "status": "alternate"
  },
  {
    "sharps": -5.0,
    "key": "B-flat",
    "mode": "Minor",
    "composer": "Shostakovich",
    "piece": "#13",
    "notes": "",
    "scoreUrl": "",
    "ytUrl": "",
    "status": "candidate"
  },
  {
    "sharps": -4.0,
    "key": "A-flat",
    "mode": "Major",
    "composer": "Dvorak",
    "piece": "105.0",
    "notes": "",
    "scoreUrl": "",
    "ytUrl": "",
    "status": "candidate"
  },
  {
    "sharps": -4.0,
    "key": "A-flat",
    "mode": "Major",
    "composer": "Shostakovich",
    "piece": "#10",
    "notes": "",
    "scoreUrl": "",
    "ytUrl": "",
    "status": "candidate"
  },
  {
    "sharps": -4.0,
    "key": "A-flat",
    "mode": "Major",
    "composer": "Krommer",
    "piece": "72/3",
    "notes": "",
    "scoreUrl": "https://imslp.org/wiki/String_Quartet%2C_Op.72_No.3_(Krommer%2C_Franz)",
    "ytUrl": "",
    "status": "rejected"
  },
  {
    "sharps": -4.0,
    "key": "A-flat",
    "mode": "Major",
    "composer": "Spohr",
    "piece": "84/2",
    "notes": "",
    "scoreUrl": "https://imslp.org/wiki/3_String_Quartets%2C_Op.84_(Spohr%2C_Louis)",
    "ytUrl": "https://www.youtube.com/watch?v=9CpSDFYnUOY&list=PL69JDRVA-746hxeRUOVZHQ4Kako2oaqE9&index=28",
    "status": "alternate"
  },
  {
    "sharps": -4.0,
    "key": "A-flat",
    "mode": "Major",
    "composer": "A. Rubinstein",
    "piece": "#9",
    "notes": "",
    "scoreUrl": "https://imslp.org/wiki/String_Quartets_Nos.9-10%2C_Op.106_(Rubinstein%2C_Anton)",
    "ytUrl": "",
    "status": "rejected"
  },
  {
    "sharps": -4.0,
    "key": "F",
    "mode": "Minor",
    "composer": "Boccherini",
    "piece": "26/6(p) or 52/4(g)",
    "notes": "",
    "scoreUrl": "",
    "ytUrl": "",
    "status": "candidate"
  },
  {
    "sharps": -4.0,
    "key": "F",
    "mode": "Minor",
    "composer": "Haydn",
    "piece": "20/5",
    "notes": "last mvt fugue",
    "scoreUrl": "",
    "ytUrl": "",
    "status": "candidate"
  },
  {
    "sharps": -4.0,
    "key": "F",
    "mode": "Minor",
    "composer": "H. Jadin",
    "piece": "",
    "notes": "",
    "scoreUrl": "https://imslp.org/wiki/3_String_Quartets%2C_Op.1_(Jadin%2C_Hyacinthe)",
    "ytUrl": "https://www.youtube.com/watch?v=1WgNchgUhnY",
    "status": "alternate"
  },
  {
    "sharps": -4.0,
    "key": "F",
    "mode": "Minor",
    "composer": "Grieg",
    "piece": "Fugue in F minor for String Quartet, EG 114",
    "notes": "",
    "scoreUrl": "https://imslp.org/wiki/Fugue_in_F_minor_for_String_Quartet,_EG_114_(Grieg,_Edvard)",
    "ytUrl": "",
    "status": "alternate"
  },
  {
    "sharps": -3.0,
    "key": "Eb",
    "mode": "Major",
    "composer": "Boccherini",
    "piece": "tbd {15 options}",
    "notes": "",
    "scoreUrl": "",
    "ytUrl": "",
    "status": "candidate"
  },
  {
    "sharps": -3.0,
    "key": "Eb",
    "mode": "Major",
    "composer": "Haydn",
    "piece": "76/6 or 71/3",
    "notes": "significant fugal sections",
    "scoreUrl": "",
    "ytUrl": "",
    "status": "candidate"
  },
  {
    "sharps": -3.0,
    "key": "Eb",
    "mode": "Major",
    "composer": "Mendelssohn",
    "piece": "44/3",
    "notes": "fugue in scherzo",
    "scoreUrl": "",
    "ytUrl": "",
    "status": "alternate"
  },
  {
    "sharps": -3.0,
    "key": "Eb",
    "mode": "Major",
    "composer": "Mendelssohn",
    "piece": "81#4",
    "notes": "fugue",
    "scoreUrl": "",
    "ytUrl": "",
    "status": "alternate"
  },
  {
    "sharps": -3.0,
    "key": "Eb",
    "mode": "Major",
    "composer": "Shostakovich",
    "piece": "#9",
    "notes": "fugue in last mvt",
    "scoreUrl": "",
    "ytUrl": "",
    "status": "alternate"
  },
  {
    "sharps": -3.0,
    "key": "C",
    "mode": "Minor",
    "composer": "Boccherini",
    "piece": "tbd {6 options} -- played 41/1",
    "notes": "",
    "scoreUrl": "",
    "ytUrl": "",
    "status": "candidate"
  },
  {
    "sharps": -3.0,
    "key": "C",
    "mode": "Minor",
    "composer": "Mozart",
    "piece": "Adagio and Fugue, K. 546",
    "notes": "",
    "scoreUrl": "",
    "ytUrl": "",
    "status": "candidate"
  },
  {
    "sharps": -3.0,
    "key": "C",
    "mode": "Minor",
    "composer": "Haydn",
    "piece": "17/4",
    "notes": "",
    "scoreUrl": "",
    "ytUrl": "",
    "status": "alternate"
  },
  {
    "sharps": -3.0,
    "key": "C",
    "mode": "Minor",
    "composer": "Beethoven",
    "piece": "18/4",
    "notes": "2nd mvt fugue-ish",
    "scoreUrl": "",
    "ytUrl": "",
    "status": "alternate"
  },
  {
    "sharps": -2.0,
    "key": "B-flat",
    "mode": "Major",
    "composer": "Boccherini",
    "piece": "",
    "notes": "3rd mvt marked \"Fuga con spirito\"",
    "scoreUrl": "",
    "ytUrl": "",
    "status": "candidate"
  },
  {
    "sharps": -2.0,
    "key": "B-flat",
    "mode": "Major",
    "composer": "Beethoven",
    "piece": "130+133",
    "notes": "Grosse Fuge",
    "scoreUrl": "",
    "ytUrl": "",
    "status": "candidate"
  },
  {
    "sharps": -2.0,
    "key": "B-flat",
    "mode": "Major",
    "composer": "Haydn",
    "piece": "tbd",
    "notes": "",
    "scoreUrl": "",
    "ytUrl": "",
    "status": "alternate"
  },
  {
    "sharps": -2.0,
    "key": "B-flat",
    "mode": "Major",
    "composer": "Shostakovich",
    "piece": "#5",
    "notes": "fugue in last mvt",
    "scoreUrl": "",
    "ytUrl": "",
    "status": "alternate"
  },
  {
    "sharps": -2.0,
    "key": "G",
    "mode": "Minor",
    "composer": "Boccherini",
    "piece": "tbd {4 options}",
    "notes": "",
    "scoreUrl": "",
    "ytUrl": "",
    "status": "candidate"
  },
  {
    "sharps": -2.0,
    "key": "G",
    "mode": "Minor",
    "composer": "Haydn",
    "piece": "20/3",
    "notes": "",
    "scoreUrl": "",
    "ytUrl": "",
    "status": "candidate"
  },
  {
    "sharps": -2.0,
    "key": "G",
    "mode": "Minor",
    "composer": "Grieg",
    "piece": "",
    "notes": "so much G minor . . .",
    "scoreUrl": "",
    "ytUrl": "",
    "status": "alternate"
  },
  {
    "sharps": -1.0,
    "key": "F",
    "mode": "Major",
    "composer": "Boccherini",
    "piece": "tbd {8 options}",
    "notes": "",
    "scoreUrl": "",
    "ytUrl": "",
    "status": "candidate"
  },
  {
    "sharps": -1.0,
    "key": "F",
    "mode": "Major",
    "composer": "Mozart",
    "piece": "K. 168",
    "notes": "2nd mvt canon, 3rd mvt fugue",
    "scoreUrl": "",
    "ytUrl": "",
    "status": "candidate"
  },
  {
    "sharps": -1.0,
    "key": "F",
    "mode": "Major",
    "composer": "Haydn",
    "piece": "tbd",
    "notes": "",
    "scoreUrl": "",
    "ytUrl": "",
    "status": "alternate"
  },
  {
    "sharps": -1.0,
    "key": "D",
    "mode": "Minor",
    "composer": "Bach",
    "piece": "Art of Fugue",
    "notes": "",
    "scoreUrl": "",
    "ytUrl": "",
    "status": "candidate"
  },
  {
    "sharps": -1.0,
    "key": "D",
    "mode": "Minor",
    "composer": "Mozart",
    "piece": "K. 173",
    "notes": "last mvt fugue",
    "scoreUrl": "",
    "ytUrl": "",
    "status": "candidate"
  },
  {
    "sharps": -1.0,
    "key": "D",
    "mode": "Minor",
    "composer": "Boccherini",
    "piece": "9/2(g)",
    "notes": "",
    "scoreUrl": "",
    "ytUrl": "",
    "status": "alternate"
  },
  {
    "sharps": -1.0,
    "key": "D",
    "mode": "Minor",
    "composer": "Haydn",
    "piece": "42.0",
    "notes": "last mvt fugue",
    "scoreUrl": "",
    "ytUrl": "",
    "status": "alternate"
  },
  {
    "sharps": -1.0,
    "key": "D",
    "mode": "Minor",
    "composer": "Glazunov",
    "piece": "Prelude and Fugue",
    "notes": "1st mvt of Les Vendredis",
    "scoreUrl": "",
    "ytUrl": "https://www.youtube.com/watch?v=IMn0YpffIc4",
    "status": "alternate"
  },
  {
    "sharps": 0.0,
    "key": "C",
    "mode": "Major",
    "composer": "Haydn",
    "piece": "20/2",
    "notes": "last mvt fugue",
    "scoreUrl": "",
    "ytUrl": "",
    "status": "candidate"
  },
  {
    "sharps": 0.0,
    "key": "C",
    "mode": "Major",
    "composer": "Beethoven",
    "piece": "59/3",
    "notes": "last mvt fugue-ish",
    "scoreUrl": "",
    "ytUrl": "",
    "status": "candidate"
  },
  {
    "sharps": 0.0,
    "key": "C",
    "mode": "Major",